{
  "name": "santtos-sales",
  "pace": "medium-fast",
  "captionStyle": "emphasis",
  "motionDensity": 0.5,
  "zoomIntensity": 0.07,
  "soundDesign": "subtle",
  "visualDepth": "medium",
  "transitionStyle": "invisible",
  "accent": "#ffbe83",
  "fontFamily": "Arial, Helvetica, sans-serif",
  "captionSize": 58,
  "captionBottom": 245,
  "maxHighlights": 2,
  "minSoundGap": 2.0,
  "soundVolume": 0.12,
  "maxSimultaneousVisuals": 2
}
