{
  "name": "santtos-clean",
  "pace": "medium-fast",
  "captionStyle": "emphasis",
  "motionDensity": 0.45,
  "zoomIntensity": 0.08,
  "soundDesign": "subtle",
  "visualDepth": "medium",
  "transitionStyle": "invisible",
  "accent": "#b8f36b",
  "fontFamily": "Arial, Helvetica, sans-serif",
  "captionSize": 58,
  "captionBottom": 245,
  "maxHighlights": 2,
  "minSoundGap": 1.8,
  "soundVolume": 0.12,
  "maxSimultaneousVisuals": 2
}
